Type,Restaurant_Name,Review_Title,Sentiment,Rating,Review_Date,Review_Content
Chinese,London Fat Duck,Over-priced duck and pathetically small portion,-1,20,5/5/2016,"We were at the Waterway Point outlet last evening for dinner. Needed to wait 20 to 30 minutes for a table on a weekday night. We were attracted by the long queue to try the food there. The portions were pathetically small. Unreasonably over priced for everything, especially for the plate of duck noodles with only four thin slices of duck meat @$8.80 and tasted bland. When you asked for chilli, the waitress would forget totally even though you reminded her twice. That would be our first and last visit to London Fat Duck."
Chinese,London Fat Duck,"Overpriced Soggy Roast Duck and Roast Pork, Reheated Char Siew ",-1,10,5/4/2016,"Was at the Waterway Point outlet this evening for dinner. Waited for more than half an hour for a table at 7:30pm on a weekday night. Portions were small. Ridiculously over priced. Plain steamed rice was $2 per small bowl. 15 thin slices of char siew costs $12.80. First time, last time and one time too many!"
Chinese,London Fat Duck,It was just average,-1,30,5/2/2016,"No need to queue when I was at the Waterway Point outlet for a weekday late lunch.Tried the mixed roast platter (signature roast duck, crackling pork belly & bbq pork), black pepper bun and wanton noodle.I find the black pepper taste was too strong for the bun. The roast duck was nice, but nothing fantastic. The surprised was the pork belly. The skin was indeed crackling, while the meat was tender."
Chinese,London Fat Duck,Basic,-1,30,04/28/16,"tried this at waterwaypoint mall (Punggol) ordered the signature duck congee and duck platter. food was basic so as the presentation. tasted clean though which was good.service was average. not friendly, not snobbish either. would be a good place to eat if you're just looking for something to fill the stomach but not really for culinary pleasure."
Chinese,London Fat Duck,London Fat Duck @ Waterway Point,-1,10,04/21/16,"Crispy duck but the skin is not crisp but chewy.The filling inside the signature bun is sweet, taste more like chopped up bbq pork than duck! We ordered the original flavour without the pepper. Was served the pepper ones but as it is our first time in the restaurant and they do not have any me use with pictures for you to see while seated, we therefore was not aware that they had served u the pepper version until we took one and cut up to try. We told the waitress and they only replaced with 2 buns instead of the whole plate of 3! It's not our fault if they serve the wrong item but why should we be have only 2 out of 3 replaced! Chinese tea is not even warm let alone hot.The dish servings are very pathetic for the price ."
Chinese,London Fat Duck,Not to my expectation,-1,30,04/20/16,"Prior to the dinner, I admit I had too high expectation on the food and this seemed to lower my dining experience. The theme of the dinner- London fat duck, as the name implies, the duck is indeed fat. Hence after the 5th or 6th piece of the duck, we got really full and felt sick of eating more. The restaurant also served other dim sum but the taste was so-so only."
Chinese,London Fat Duck,London duck,-1,10,4/10/2016,So so only. I can confirm it is not even near the look and taste on London roasted duck. Quite disappointed
Chinese,London Fat Duck,Over-hyped.,-1,20,4/8/2016,"With all the rave about the ""Wagyu of Duck"", I decided to try it out for myself. Let's start with the food. To be honest, the duck tasted pretty average to me. I personally prefer their Char Siew better than the Roasted Duck (and my girlfriends agreed too). Besides that, the rest of the dishes are alright. I won't say it's fantastic or like out-of-this-world. But if you do head down and try, do try their Duck Bun and Egg Tarts. That I recommend. Be warned though. With the expected waiting time (since they just opened and everyone wants a piece of their duck), the place was a little messy and chaotic. The plus point for them for our night there is the lovely wait-staff who was assisting us (just that one nice auntie) and that the food came almost instantaneously.Now, I can say ""I've been there, done that."""
Chinese,London Fat Duck,It was ok,-1,30,4/3/2016,"It was ok. Some strange flavour combinations. Food was freshly cooked and good quality.
Could find better valued meals elsewhere."
Chinese,London Fat Duck,Very fat duck indeed!,-1,30,03/25/16,I find the restaurant name cute although I can't quite connect London and fat duck. The food served here is Cantonese cuisine. Roasted duck is very fatty and a little too salty so this experience may be rather scary for health conscious eaters. I prefer the Char Siew meat as it is pretty well done. Food quality is good but not exceptional. I do know of hawker stalls that serve similar or higher quality roasted duck.
Chinese,London Fat Duck,Food quality so so only. Duck is too fat. Lousy customer service.,-1,20,03/20/16,"We ordered the duck noodle. The duck tasted so so only. It had way too much fat for our liking. The noodle was bland and had very little sauce on it. I didn't take the veg because the leaf hung out of the plate and touched the table - disrespectful of the food and the customers they serve.Biggest turnoff: The service staff put the dishes meant for the table besides us on our small and cramp table while they made space over there. They neither asked for our permission nor apologised for the inconvenience and discomfort caused. They couldn't be bothered whether it disturbed our dining pleasure. I will NEVER eat there again, ever!"
Chinese,London Fat Duck,Can't even surpass duck rice Ina hawker centre,-1,10,3/12/2016,"We ordered duck with rice, crackling pork with rice, each dish $7.80. It came with one half stalk of xiaobaicai, and just a splash of sauce. The duck was powdery to taste. It was quite honestly a big disappointment and there are many hawker centres which would easily surpass this restaurant in standard. A dish of oyster veg also cost $$7.80, consisting of eight half stalks of xiaobaicai boiled and splashed with oyster sauce. There was no queue. We told the wait staff that the food was not acceptable. She thought we were talking about the rice itself, and could not believe that we were talking about the duck. Never again "
Chinese,London Fat Duck,Duck is fat,-1,30,3/7/2016,"Visited the shop twice. The duck is tasty but is fat. Noodle with roasted pork is nice. Overall, foods are good but not the best in town."
Chinese,London Fat Duck,Tasty duck but average dim sum,-1,30,3/7/2016,"Xiao Long Bao is juicy and meaty but the dipping sauce is salty with little ginger . Dried wanton noodle is eaten best with chilli sauce , only comment is quite pricy with little noodles served. ""Ting chai"" congee is actually congee with cuttlefish and peanuts . But the peanuts too hard. Duck is juicy and oily , if you don't mind the oil. Meat is tender. Service is good. "
Chinese,London Fat Duck,Over HYPED ,-1,20,3/5/2016,"For the branding I would have to say really smart putting the name ""London"" in there. I bet many people would have mistaken this place coming from London, only the duck and it's not even from London it's from Ireland.Anyway enough of the history lesson, here is my verdict and as a fan of roast duck, I have my fare share of top ducks around HKG and London this one rank lowly if I were to compare with any of the restaurants I've tried.Taste wise i would have to agree the fats of the duck is really juicy but the let down came with the tenderness and the sauce let alone presentation (not that Goldmine has any beautiful presentation) but I just can't accept the pungent after taste you get.The Char siew is dry and bored with overly sweeten sauce. Wanton noodle was good with plump shrimps Wanton and al dente noodle but soup was just overly salty to my liking.The redeemer here is the liu sha bao, all I have to say try is their dim sum more than what they are known for.Don't expect much service as wait staff seems clueless at times and I was served the wrong dish. Was at the Punggol outlet at 10.15am. If you want duck.. I suggest you going to other places"
Chinese,London Fat Duck,Appalling Service,-1,10,3/1/2016,"Food was alright, no wow factor. We were truly disappointed with the service, rude and unreliable. I also ordered take away however they missed out a few items on the list but yet I was charged for the dimsum. And when I returned a couple of days later to claim the missing items, the service staff was not happy. Did not even apologise!Extremely poor service!"
Chinese,London Fat Duck,Not as good as the first time,-1,30,02/27/16,The duck was a disappointment this time. It tasted a bitter and was rather fat. The dim sums were good but nothing to shout about. However the custard buns were worth eating. They were uniquely baked with pandan on the outside
Chinese,London Fat Duck,Average,-1,30,2/3/2016,"We were disappointed with the poor service, very small meal sizes and expensive for what you got. The food was ok, plenty of other better places in Singapore to go. Wouldn't go back."
Chinese,London Fat Duck,Singapore Oily Bird,-1,20,01/28/16,"So what if they source their ducks from a renowned farm in London? Without the know-how and skills, even if they use some sort of celestial phoenix, it will still taste mortally cheap.However, London Fat Duck achieved in proving to be a model example of Marketing 101.So A for marketing, a big fat and oily F for everything else."
Chinese,London Fat Duck,Over rated!,-1,30,01/20/16,"Before today I had only ordered takeaway char siew which was nice and tender but expensive @ $15.90 for 11 small slices. Not sure that it was worth it. I had also ordered the black pepper duck buns (all good - moist, tender duck, soft bun - except maybe a bit too much of the black pepper).Today I had a late lunch in the restaurant. By the way, they have taken additional space (see photo). Had duck noodles and warm barley. Duck was tender, skin not crispy at all. I had to remove the fat but alas the skin came off too. Barley was not even warm. Waiters and Waitresses in Singapore food outlets have a problem understanding 'hot', 'warm' & 'luke warm'.So my conclusion is that it is not 'die, die must eat'."
Chinese,London Fat Duck,Overcharging poor service,-1,20,01/17/16,"Used to like this place a lot for the food - would have given 5 stars thenNow, Duck and noodles the only things worth making the trip forService is poor, even worse than HK fast food restaurants - part time staff are better than the full timersToo many things wrong with the service to listTip - dont go for meals In between times just have a plate of duck and noodlesTip 2 - costs less per head if u bring small children as their tables are strictly per head and not by the amount of food you order (they will clear unfinished plates to make room for all the dishes you order if you order 'too many' dishesTip 3 - check the bill, overcharging happened more than onceOtherwise you'd do better at a more upscale dim sum restaurant w/out overcrowding, condescending attitudes and staff chasing you out so that they can pack in the next bunch of familiesOr if you're just into noodles, for similar quality noodles (sadly, no irish ducks) go to Maks at CentrepointAverage bill for 2 - US$70 without beverages"
Chinese,London Fat Duck,It's a fat duck with HK attitude,-1,30,1/9/2016,"It's an aircon eatery, your typical modern HK roasted meat shop in a mall. The service is something you need to manage your own expectations, do not expect well trained staff. You won't get patient introduction of each dish, or recommendations, you are quite expected to write down what you want on the menu paper and have little chit chat. That said, the duck is good, noodles decent, soup is the usual HK too salty type, wanton noodles, dim sum, etc are average. I would come back again, but not often. The food is decent for the price you pay. But that said, you can get very similar standard at any neighborhood coffee shop roasted meat delights stalls. "
Chinese,London Fat Duck,Very fatty Duck,-1,30,1/4/2016,"Ordered normal very fatty Duck, tasty and nice Pork Belly, over burn at the side of Char Siew tasted bitter and satringent rice and noodle.
Told the waitess, she scine unhappy to take my comment."
Chinese,London Fat Duck,Okay Duck and DIm Sum,-1,30,1/3/2016,"We had our 2015 Countdown in Singapore. My Sister insist that we visit this place as she had a good experiences here and compared it with the duck we had in London.Was told that this place is usually pack and queue up to two hours!! We went early New Year (1 Jan 2016) morning (10:00am), since everyone still suffering from hangover during countdown (haahaahaa)....We ordered duck, pork belly, char Siew, and dim sums.The duck is good but not great. Quite bony. Crispy Pork Belly and Char-Siew are better.Dim Sum are not bad too. The Crispy Char-Siew Pao is a must tryThe plain noodle is quite tough, not good.When we finished around 11:15am, the queue already formed. Overall, its okay food. Give it at try.The place is in Basement 1 (B1) Scott Square Orchard Road) The building next to Tang Plaza (which is opposite ION)"
Chinese,London Fat Duck,2nd try for egg tarts,-1,30,1/1/2016,"Went around 6pm. Luckily the crowd is not big. Manage to get a table for 2. Try the duck noodle, duck peppers poa, chicken legs n red beans jelly. The noodle is salty n nothing special. Ask for egg tarts but is out of stock. They don't have time to make the base. Will try another time..."
Chinese,London Fat Duck,Duck was not the star!,-1,30,11/28/15,"Visited the London Fat Duck today. We had the Roast Duck, crispy Pork Belly, Char Siew Bao crispy buns and Cheong Fun. With Chinese tea and Barley the total bill was just over $50. The star dish was the pork belly. The duck was so-so with a lot of bone and not too much meat. I would not go back for the duck but the other dishes were good. Service was quick and efficient. "
Chinese,London Fat Duck,So so duck....,-1,30,11/21/15,Previously when it opened the queues were long and the duck was juicy and delicious....Went back recently and we were able to get a table easily (has the interest died?)....and the duck was not as good as before. ...And they only have one type.of vegetable.....no choice....
Chinese,London Fat Duck,On the fence,-1,30,11/13/15,"Had lunch with friends about a month ago and we all found the duck and char siew pretty yummy. I like my pork slightly fatty and the char siew at London Fat Duck had just the right balance, in my opinion. It was also nicely charred on the outside. The duck meat was moist and tender. And not gamey. Service was prompt. I returned once to do a takeaway. Something I wouldn't do again. The taste just wasn't the same and everyone at home felt it was no better than the roast duck at our nearby food centre. This proves once again that many foods are best eaten on the spot. I'd be happy to go back to London Fat Duck for that plate of duck noodles or char siew rice if there isn't any queue."
Chinese,London Fat Duck,"Great Duck, Lousy Service ",-1,20,10/19/15,"This review is not about the food as I have reviewed this before. Have the much applauded roast duck as well as roast meats but you certainly don't come here for the exemplary service.Firstly I have to say my expectations are minimal as this is not a fine dining restaurant, just your basic Chinese eatery. Having established this, I would have to express shock at being driven out after 40 minutes. This is something that has never happened to me. Ever.I had lunch with friends & while there was never any intention to linger, even my friends were shocked at the level of rudeness when we were asked to leave after the last dish was cleared. There was no attempt to ask if we cared for dessert. Last time I ate here, service was brusque & I did not expect much. In future if I craved the duck, it would be better to get take out rather than sit through this sort of treatment. It isn't worth it & we weren't even demanding customers. All we asked was to be able to leave when we were ready. By the way it was the tail end of lunch & there certainly wasn't a queue."
Chinese,London Fat Duck,Just alright...,-1,30,10/2/2015,"Waited for more than 30mins on a Friday dinner. Worth the wait? I don't think so. Can get half the price for the duck noodle at hawker, with similar or better taste. For those who like the duck snow bun, can give it a try. Sweet and crispy. "
Chinese,London Fat Duck,Not impressed,-1,10,09/27/15,"If I am not mistaken, this restaurant is inspired by the four seasons and gold mine in bayswater, London. We had the roast duck, char siew, egg tart, duck snow bun and weren't impressed with either of the items. The duck fat wasn't rendered at all - the roast roast duck had thick slab of fat between the skin and meat. I didn't know they meant the name London fat duck that literally. In my opinion, the ideal roast duck should have succulent meat texture but with minimal visual fat between the skin and meat. The meat was kind of dry in this case. Char siew was okay, loads of honey. Egg tart had more flour taste than egg. The duck snow bun needs improvement because the snow bun is sweet with the powdered sugar on top, the duck sauce was even sweeter. Just a quarter of this snow bun sends you in line for diabetes. I guess we just expected so much more because we liked the four season's version of roast duck and when we visited the restaurant, we had the impression that it would be similar."
Chinese,London Fat Duck,Go for the Duck!,-1,30,08/31/15,"Ok, the name is attractive. Expect to queue since the restaurant doesn't take reservations. The duck is fatty, dripping with oil, succulent, sinful i.e. tasty. The other must-try dish is the pepper-flavoured duck meat bun which is freshly baked. Apart from these, I had tried the char siew and the roast meat, both of which seemed a tad ordinary. But the duck is worth coming back for. Service is quite prompt and courteous. A crowd-puller in the otherwise quiet basement of Scotts Square. "
Chinese,London Fat Duck,Duck is great,-1,30,08/28/15,"Decided to bring my in-laws to this new duck outlet for dinner after knowing that the brand now has a branch here in singapore as i am a big fan of roasted duck.First impression was that the restaurant felt more like a food court. We were directed to the VIP room. The VIP room consists of 2 large tables and sadly, the other group in our room was very noisy and rowdy as its a group consisted of all men, most like colleagues. Anyway, the background music was also very loud and thus, very irritating. Called the server to ask them to turn down the volume but told me cannot be done. Asked her to get her manager and after her manager came in, he decided to lower the volume.Service is only so-so and atmosphere as well. But the duck is good in my opinion. But i expect a complete dining experience as the food here is not really cheap as well. Wanted to change the size of the dishes we ordered after they served them and we realised its too little for all of us. The server told us that we cannot do it. I was so puzzled why not as simply they could bring back the medium plate of duck and add more to it. Instead she asked me to order another medium plate which made the whole meal more expensive.If its not for the service and atmosphere, i would have given it a 4 out of 5!"
Chinese,London Fat Duck,Long wait for slightly above average food,-1,30,08/23/15,"Arrived at 6:30 pm on a Sunday night and saw a small crowd already waiting. Was told the wait will be about 20 mins which was acceptable but instead we waited for almost 45 mins before given a table for 7 of us.As mentioned the place is more a cafeteria style whereby you select from the order chit the food you wanted. Looking at the prices, would same it is reasonable considering the location and service is much better than expected.The side dishes such as the porridge is good as well as the duck bun.However the duck as mentioned is very fatty to suit me though the skin is rightly roasted. They should work on improving the choices of vegetables though as there is only 1 item. Overall the price is reasonable but not worth the wait."
Chinese,London Fat Duck,A shame to call it London . .,-1,30,8/2/2015,"I have lived many year in London,"" though many years ago "". . and love the duck served in the Chines restaurants there. The duck here does not live up to any that I have had in London, in any restaurants there.I like the buns with a sweet black peber crust though . and i am glad I went for these.I will only go if I was close by . . again"
Chinese,London Fat Duck,Fat Duck!!!,-1,30,07/30/15,"I am not a fans of Duck meat but London Fat Duck had left a deep impression in my mouth. For health conscious people might not like the fatness of the meat. I Iove the fatness of the meat, soft to chew and the roasted Skin is crisp, goes very well with the plum sauce. Tried their signature Chee Cheong Fun, it's actually the fried prawn spring roll wrap with Chee Cheong Fun, interesting combine and its delicious. Black Pepper duck Snow Bun taste like McDonald's Prosperity burger. Overall feel the food is good but might not want to queue too long for a table. "
Chinese,London Fat Duck,Over Hype Average Food,-1,30,7/5/2015,"LFD is not related to the Four Seasons Restaurant in London and also has nothing to do with the Fat Duck in UK. Instead the ducks were claimed to be Irish. It is only a typical Hong Kong style Cantonese restaurant.Although the shop names emphasised on duck, you can also find many others Hong Kong style dim sum, wanton noodle and etc. The roast ducks is nice but not fantastically nice. The ducks served was fat and juicy. On the other hand the Honey sauced Char Siew is surprisingly good. Fat but not greasy. We didn't get to try the roast pork. The other dim sum and dumpling that we had ordered are actually quite authentically Hong Kong that you can find it in any Hong Kong street stalls.The time we visited the restaurant was on a Saturday evening and long queue had already formed and we have to wait for 50 mins to get our table. By the time our turn was up at 8pm, many items on the menu had been sold out.The pricing of the food is at mid range and mostly appropriately priced except the white rice that cost us SGD2.50 per bowl which is outrageous.Verdict is the food is good, price is reasonable and location is good so we don't mind coming back again if the waiting time can be shorter."
Chinese,London Fat Duck,Nothing much special,-1,10,7/1/2015,"I was waiting for someone to assist me to be seated when a guy approached me and lead me to the table.. however, i was directed to one of the table that was dirty and seems that the previous customer had just left. . I dont mind seating but the impression could have been better if they seated me to a clean and already set up table (which they have few coz they werent that busy much when i came)..anyway i order congee with century egg.. shrimp spring roll and an ice tea.. congee came befire the drinks and it would be better if they add a little bit of veggies or perhps like spring onion inside to shrimp springroll coz it tastes to plain.. neverthe less the congee tastes ok.. "
Chinese,London Fat Duck,Fat Duck,-1,30,06/22/15,"Came here for lunch . Had dim sum and the signiture fat duck. Duck was good, dim sum was average. Service is ok."
Chinese,London Fat Duck,Go for the duck and buns. Forget the rest.,-1,30,06/21/15,Singapore hawker food is hard to beat. Fat duck buns are tasty although a bit too sweet for me. The duck has enough taste and texture to warrant another visit if you are around the area and need a quick duck fix. The char siew deserves be a mention but is priced more than its weight in gold. Long live the hawker centers!! 
Chinese,London Fat Duck,Don't be a sheep to give in to media manipulations. Riding on a bad pun of another restaurant.,-1,10,06/21/15,"Well, as stated above. my fellow Singaporeans, open your eyes and stop being media manipulated.The food is bad, seriously bad. And with prices like that, i scoff in disgust. Apparently not the 45min-1hr wait time crowd.when you are charging $12-15++ per portion of roasted meat, it better be freaking good, ESPECIALLY if that said portion is only enough for 1 person.Duck - tasteless, soggy skin, crappy 'sauce' ( 70% oil in sauce )Roast Pork - ridiculous portion (i literally laughed), Damn dry. Saw them microwaving some food items, perhaps it's pork?Char siew- passable, too sweet and cloying. Perfect if it's candied pork not char siew.Duck buns (Both black and white) - While the bun itself was good, the filling was Crap. too much Starch in the generic store-bought sauce with duck skin, barely (virtually none) any duck meat.Beef noodle soup - forgettable, with that much MSG, water also taste good.close to $100 for 3 pax, first and last time i get sheared like a sheep. Maybe the reason they omitted pricing on their website's menu is out of shame?Avoid this money focused mill. Even the roast pork stall inside serangoon nex NTUC was far superior (Not that they were any good to begin with) Felt like a tourist being sheared while leaving.Alternatives to good roasted duck is Dian xiao er, or any other place that doesn't take you for a fool."
