Type,Restaurant_Name,Review_Title,Sentiment,Rating,Review_Date,Review_Content
French,Paul,Mediocre food and service,-1,20,2-Aug-13,"The cafe au liat has no coffee taste - i compare it to the 2 other cafes in the same building - this is of poor quality. The blueberry tart was ok - nothing fantastic. While i was there some other customer, who were there before me, got irritated at not receiving one order of food, which seemed to be just an order of toast. My order was served earlier than theirs. Since there are 2 other cafes there, i would not step into this one again"
French,Paul,huge disappointment,-1,10,29-Jul-13,"Over the past years we ate breakfast at Paul Dubai regularly. Furthermore, we had good experience at Paul outlets in France.We must agree with most of the points raised from those who reviewed Paul. Customers who have patronised Paul certainly know what to expect. The cafe decor and sitting are impressive. However, the food and service need serious improvement.Coffee was normal but came only half cup full. Most of the menu dishes are served with toast bread rather than something ""french"". Omelette, mushroom came cold and looked pathetically cheap. Most of all, you had to ask for butter and jam! And they ran out of strawberry jam, which is the hallmark of Paul.If they want customer to return, they have to put their act together and bring back the real Paul's quality and image."
French,Paul,"Take away, don't waste money dining in",-1,30,20-Jul-13,"We have heard from friends and colleagues how great Paul is...the real french bakery in SIngapore, a must visit!First experience was with takeaway - perfect. Real good bread, amazing pastries, nothing to complain about, just great and we will be back again and again.Today we decided to go there for breakfast. Please, if you think about doing the same, don't bother. It really is not worth the trouble and the money you leave there.The line outside was not too bad, we only waited about 10 min. Service was fine, neither good, nor bad, quick and to the point.The worst thing is the actual food. Not what you expect from a French bakery with their prices. They make great breads and pastries, so I just cannot understand why they must serve such mediocre food. Croque monsieur for $17 with cheap turkey ham and tasteless cheese and few sad salad leaves? Salad was actually the best thing on the plate. A very big disappointment. Coffee was another disappointment. Honestly, you will have a much better breakfast at Toast Box with great coffee for a good price.We are sticking to takeaway at Paul, pastries are the best we have found in Singapore so far."
French,Paul,Atrocious service...,-1,10,16-Jul-13,Been here several time.. Always have a problem with service but never as bad as today when I have to walk off. I don't know whether if it's because I have 2 kids in tow that they don't take me seriously or I am not dressed to the nines like the other customers. Sat there like an idiot waiting for a staff to take my orders but they seem to conveniently ignored me and took everyone's order who came after me. Decided to leave because no matter how much waving got me no attention... 
French,Paul,Not Impressive,-1,20,20-May-13,"Price paid not worth for the service & food rendered. Servers not attentive, food took way too long to arrive even when the restaurant is not packed. $8 for a small cup of orange juice? But we all agreed that the best dish had to be the beef tartine :) "
French,Paul,Go for take-away,-1,20,7-Apr-13,"""Fresh"" orange juice diluted with water, a tiny tiny jam pot when you take a basket of bread to share, scruffy waiters that do not pay attention to you and 1:40 min to get served. Where are your French standards Paul?! This is the typical example of a low-cost, low-class excellent value-for-money shop that tries to export a luxury ""look"" just because they are French. You clearly failed! You are better off sticking to what you do best, Paul: nice, tasty boulangerie. Quit trying to copy your brother LaDuree, you have not gotten the same name and experience!Positives: Cooked-from-frozen croissants don't taste that bad..."
French,Paul,Poor service and attitude,-1,10,2-Apr-13,"Had afternoon tea on a Saturday afternoon... long wait for a table.Ordered tea... Tea came in a teapot which had too much water for 1 teabag. Found that out when I poured my tea, it was like dishwater .And water was not hot enough. When asked for a another teabag was told had to pay for it. I pointed out that they had put too much water in the pot for one bag and that is why I wanted another bag, we asked to speak to the manager, waiter walked away, eventually we flagged down the waiter that took our order and spoke to him about the problem with the tea, I asked for a replacement pot with a lot less water, which he obliged he then proceeded to tell me not to put so much milk in my tea!!! I usually visit Paul when in Singapore, on my previous visits the service has been good but this time will be the last time. But does it matter to them...I doubt it.. judging by the line waiting to go in and the attitude of the staff."
French,Paul,Paul's @ Nee Ann City,-1,30,1-Apr-13,French Patisserie with lousy coffee - again - my beef with restaurants using UHT milk - what's up with that? Puhlease...I know in France I would get proper quality milk with my Café Au Lait...and why not with quality French pastries and brunch? I'm not going back until they do something about the coffee - oh - and the service.
French,Paul,Ticked off the 'to do list',-1,30,18-Mar-13,"My husband and I went to Paul for a Saturday breakfast. I had been planning on going for months after salivating at the wonderful array of pattisseries in the take away section. We had an egg, turkey ham, tomato and 'soft' bread plate. The food tasted fine, but it was nothing special. Price was OK at just under $10 for the meal. I had a cappucino which was very good. The carrot and ginger juice ( a bit pricey at $8) was nice. The service was fine - prompt and obliged us moving tables - but this was before the obligatory queues mid morning. The front area is very a bit cramped - not sure what you have to do to get an inside table. The pastries looked wonderful and I wish I had chosen the croissant and coffee."
French,Paul,Worst meal I have had in Singapore,-1,10,15-Mar-13,"Our experience was so poor, I am not sure where to start. Surly, disorganized staff - dirty cutlery - ridiculous wait for a server to bring menus and to place an order. As if that was not bad enough, the overflowing garbage can was too much until one of the staff sorting clean cutlery stopped what he was doing and proceeded to pick up garbage from the overflowing can and push it down before returning to sort more 'clean' cutlery. Needless to say, we had seen enough, got our check and left....never to return. The positive thing about Paul I can think of is its location on Orchard Road."
French,Paul,"Nice food, poor service",-1,20,3-Mar-13,"We went to Paul to have a quick dinner recently. The food was good and it was served quickly although the selection wasn't quite as large as in Paris for example.However, the whole experience was let down by the poor service that we received. We arrived there close to 9 PM and the restaurant wasn't busy. We stood in front of the restaurant and waited for a wait staff to find us a table. There was a group of staff that was just standing around and gossiping and one of them (a short, Chinese auntie-looking staff) saw us but just ignored us and continued to gossip with her colleagues. Another wait staff (a Chinese guy) also saw us but also ignored us and continued to sashay past us. We must have waited for close to 5 mins before a Malay waitress greeted us and showed us to a table. We were also ignored again during the short time we were in the restaurant.I understand that this is Singapore, where service is horrible and basically non-existent. But somehow I thought it would be different given the type of establishment this is. Clearly I was wrong. We won't be back, I don't think the food is phenomenal enough to make up for the poor service that we received."
French,Paul,Absolutely terrible and not worth it,-1,10,18-Feb-13,"I visited Paul on a Sunday close to lunch time. There wasn't a line when we got there but it was relatively crowded. We got a table immediately. Then it all went downhill. We ordered water, and my glass had a smell. I asked to change it and the waitress brought another glass back and put it on one corner of the table, further away from me, when she knew it was my glass that had the smell. We ordered one Boeuf Tartine and one Crepe Complet. We had to wait for a while for the food. But when it did come, it was not hot, not even warm. It also didn't taste good. Dessert was waffle, which we shared. Again, it took a while to arrive and we had to chase for it. When it did come, it wasn't hot as well! if it took a while to come surely it must mean that it was just cooked and should be hot? It also tasted rather stale. Service staff, while not rude, hardly said anything, and merely gestured. They were however surprisingly friendly and chatty to one table away from us, probably a regular customer. All in, a really disappointing experience and I would not go back again. Neither would I recommend anyone to go there to eat. I've tried their cakes and pastries before, and they are decent. Perhaps visit if you only want cakes, but not for a meal."
French,Paul,Overhyped,-1,30,31-Dec-12,"We were in Takashimaya and we decided to try Paul. First, the queue to get a seat was long. A combination of reasons we guessed - lots of first timer diners trying out, diners were taking a long time to decide and service was slow. Yes, service was a let down. That was a combination of factors too - possible new waiters/waitresses, cramp seating space and the kitchen can't get the orders out at the same time.The food was nothing to shout about. I believe there are other pastry eateries/bakeries with equal or better baquettes, macaroons, lemon tarts and crepes and without a famous name and/of a popular location like Paul.If you have lots of time (as mentioned the queue is long), a couple (if your group is more than a couple, your wait will be longer) and no place to go in Takashimaya, then Paul could be your place. The service may continue to be poor. After all, as long as the queue is long getting in, Paul is still happy."
French,Paul,Bad and unfriendly service,-1,20,3-Sep-12,"My family and have been to Paul twice now, and twice it has been disappointing for exactly the same reason: Paul seems unable to make sure that everyone around the table gets their food at approximately the same time. The first time we had our three kids having to wait half an hour while my wife and I got our meals after maybe 10 minutes. And last time it was my wife who's breakfast hadnt even arrived when my kids and I were already long finished. Its not such a large restaurant, nor are the dishes very complicated, so it shouldnt be so difficult for Paul to serve everyone relatively quickly and at the same time.A friendly apology in such a case would go a long way, but the staff is very disinterested. They couldnt care less it seems. We had to cancel my wife's meal.It's a shame, if Paul could train their staff better, it would be a great (though still very pricy for such simple dishes) place for breakfast and lunch."
French,Paul,Nice environment,-1,30,11-Jul-12,"Went there for breakfast as the breads, pastries and tarts look tasty. The place was very nice though but the breads are some how a little disappointed. The baguette was a little under proof as the result for after baking, the bread was soggy on the inside, very chewy. The other food wise was so so. Service wise was excellent. Good service and courtesy."
French,Paul,Middle of the (Orchard) Road...,-1,30,23-Jun-12,"I spend some time with friends sampling food at Paul's...it's located, conveniently, right in the middle of Orchard Road at Ngee Ann City, better known as Taka!In short, it's a salad place, the service a little of an afterthought and the name more of a hype. The queue is long and the food is just not great. The tables are placed close together and an overall sense of claustrophobia is prevalent. However, try the salads, they are fresh and creatively mixed with prawn or chicken and make for a good healthy stop-over break from luxury shopping."
French,Paul,Good food; service can be improved :-),-1,30,28-May-12,"The last time I headed down to Ngee Ann, I noticed that there was a new restau. I was quickly intrigued by the new place upon seeing from afar that 1.) the interiors looked very nice, 2.) the place was packed (a good indicator that it's a must-try), and 3.) there was a queue just outside the dining place. Some friends and I recently tried Paul for a Sunday brunch. Because we arrived at the place around 1130, we didn't have to queue for long to get a table. Our table was very near the bakery of the cafe, which gave us a good view of all the baked goodies. I was more excited about the breads rather than the brunch menu. Hehe!I ordered the Crepe Complete - turkey and cheese in a pancake topped with a fried egg. It also came with a small portion of greens. For dessert, we got a fruit tart, a lemon tart, Napoleon, and macarons. I must say that I enjoyed dessert more. While the crepe tasted nice, I would have added a few more dollars to what I paid and I could have had a bigger brunch plate at one of the other brunch places around the island. The desserts (and most probably the breads) would be the main reason to head to Paul. Just beside the restau, the bakery would be found. The few hours we sat there, there wasn't a moment where there was no customer buying baked goodies. Really nice. What Paul can improve on is the service. It's kind of challenging to get the attention of the wait staff. Sure, the place was packed but that has never been an acceptable excuse for me. Nevertheless, I think I will go back to Paul to try the mains or if I happen to be in the area, and I'm craving for some nice pastries or freshly baked bread."
French,Paul,"Tourist don't go, Singaporean don't bother, Ngee Ann basement offer better food",-1,10,6-May-12,"I heard of this restaurant from my friends 8 months back. Decided to try it.Initially I thought that the restaurant was very nice with the queue. Only to realised that they actually kept the tables empty to create the queue.Google ""Paul Bakery Hungrygowhere"" you'll probably find more negative comments on the Paul Bakery.Things that went really wrong:- coffee was way too acidic- chocolate cake was worse than me making a brownie instant mix. I'm not kidding- creme brulee taste worse than instant mix as well- crepes was average- service is really badSummary it's a place that looked European but serve really lousy desserts. Menu looks nice but it don't taste nice at all. Totally disappointment, spend SGD 42. I'll probably feel happier spend that amount in Ngee Ann City Basement.I'm writing this review because it's definitely NOT worth the visit and the high review on Trip Advisor is totally misleading. If I'm the tourist, I'll be totally pissed off if I tried this place. Singaporean, please just go to basement, the food there MUCH better than this place."
French,Poulet,Decent food however not worth the price.,-1,30,21-Sep-18,"Visited this place with my gf for dinner. The service was good however the portion sizes werent exactly large. Even though the food tasted pretty good, I wouldn't return because of the price. I feel the price they charge isnt realistic for what you get, there are far better options out there for that."
French,Poulet,Affordable Lunch,-1,30,2-Dec-16,"Been years since we last visited. We ordered their set combo for 2 pax. Very satisfying and filling combo set which includes 2 choice of drinks, 2 x mushroom soup, 2 side dishes, Salad de Paris and Poulet Roti.The chicken was deeply flavoured with a tint of citrus taste in the meat. We felt the mushroom chardonnay sauce was unnecessary because that would actually cover up the aroma from the meat and made the chicken skin less appetising. Overall experience "
French,Poulet,Could have been better,-1,30,14-Jul-15,"Poulet occupies a choice location on the 2nd floor of Chinatown Point. It's normally packed at lunch time and on weekends but it was relatively quiet on a Monday night. I decided to order their signature dish, the poulet roti (rotisserie chicken) which came in a shallow dish of mushroom cream sauce with some spinach leaves sprinkled around ($15.90 for half a chicken). My dish arrived incredibly quickly, possibly within a minute. The cream sauce was quite nice and the half portion of chicken was more than enough for one person. However, it was clear that my chicken had been left for too long on the rotisserie as the breast meat was a bit dry and the thigh meat was alright but not juicy the way freshly roasted chicken should have been. The thigh meat had also darkened in colour, indicating that it had been heated for a while. I also found the dish a bit salty. The marinade had penetrated the thigh meat, but that meant it was also on the salty side. Perhaps if it had been a busier day, the turnover of dishes would have been faster and I would have received a more tender and juicy chicken. My glass of water was, as other reviewers mentioned, 50 cents, although to be fair, the waitress did highlight this to me beforehand. However, it was a nice, quiet venue to catch a quick dinner and the staff were quite friendly and attentive."
French,Poulet,Thirsty? We don't care.,-1,20,8-Jul-15,"This one gets a 2 because the food was good. We asked for 4 different dishes and all were well made, better than expected for such a restaurant. But a restaurant is not only about the food. There is more pleasure in eating good food when the service makes you feel welcome, and Poulet did not make us feel welcome. What irritated me is that we had arrived feeling very thirsty and we were not offered a glass of water. I could see a jar of water by the cashier and waited many minutes to see a waiter on site. When I finally got a waiter, I asked him for cold water to which he replied that they had no cold water but only hot water and that the glass would cost us 50 cents a piece! This is something I've never heard of: restaurants charging for tap water. Water is a basic need, especially in hot places like Singapore, and it should be common courtesy in a restaurant to serve it liberally. I only did not get up to leave because we had 2 hungry kids with us. We ended up asking for mineral water because we'd not pay for tap water, much less hot tap water (Yes, I know this is exactly what they wanted us to do). Poulet really lost me there. I'll never return because I see this as pure stinginess. Considering their high prices (you've got to ask for a few side dishes in order to get a complete, balanced meal with your expensive half chicken) and the fact that customers do pay for service charges, it's really bad and absolutely unreasonable that they would not serve cold water; therefore, I'd rate it a no-no for customer service friendliness, which -- let's be frank -- is all what a restaurant is about apart the food itself."
French,Poulet,Quick lunch in Bedock Mall,-1,30,3-Jul-15,"French style chicken place, very resonably priced lunch in a Mall.Simple fast and good tasting food, service was Ok i had the Belly pork, a little on the small side as portions go, especially as they are serving half a chicken for teh same price, one of our group had an open sandwich which more resembled a Pizza nice all the same."
French,Poulet,Uncomplicated French lunch,-1,30,24-Jun-15,"The three things ambience, food and the services make together a great dining experience - of which service is made finitely a strong point at least for this outlet. I had poulet roti half for the lunch at sgd 15.9 and topped it up by soup and ice lemon tea for another sgd 5. The mushroom soup was good - liked the bread crumbs. The chicken came in a pool of mushroom cream sauce - slightly salty but ok to my taste bud. The half roast quantity was generous - can easily be shared. The ambience was interesting with the open kitchen - overall overpriced for local standard but underpriced from French dining perspective - overall average and uncomplicated. "
French,Poulet,A cuisine is not just assemble ingredients in a plate,-1,10,21-Jun-15,"Went to the Chinatown Point branch.First time I tried a ""French"" cuisine, and it is disappointing. We order half a roasted chicken that they are famed for. The chicken tasted bland, and at most, it is only warm, not hot. I suspected it was micro wave before serving, (the chicken skin is soggy as well). It was served on a big plate of mushroom cream sauce, but, when dipped with chicken, the cream overpower the chicken taste. you are effectively eating cream.Second dish is Duck with red wine. There is no taste of red wine in it. Again, the duck thigh is lukewarm, soak in the so called red wine sauce. The duck taste bland too, and it is too dry and hard. and quite an obvious smell of frozen duck. Both dish is a typical example of, just assembling ingredients together in a plate, and called it a dish.Where has all the culinary goes?Paid about S$16 (before +10+7 %) for above each dish. Though the ambient is ok, but not worth the eat. For foreigners, there is a food centre just right behind Chinatown point mall, plenty of good food there, get a half chicken, or half a real roast duck, and eat your heart out."
French,Poulet,quick!,-1,30,5-May-15,i had the duck and my friend had the lamb. both dishes looked pretty much the same. however the meat was fall of the bone kinda good! Had the Rasberry lemonade which wa snice but the creme brule was really nice! Tiramasu is served in a canister and its alright.
French,Poulet,Salty and costly food,-1,20,10-Jan-15,"Maybe it's our taste buds. But both my wife and I found the food to be rather salty. We both also had a feeling of wanting to throw up after the meal. Customer service was bad. Before clearing the used plates on the tables, they brought in another set of food and there was no place to put them on the table. Water is chargeable at 50 cents per glass. Came with high expectation but going off with dissatisfaction. Total bill was rather costly for two pax. "
French,Poulet,Not the second time,-1,20,10-Jan-15,"I visited this place as I was craving for French food but it is not really serving the ""amazing"" French dish. The poulet rôti and baguette are just too local."
French,Poulet,Westgate Poulet is the branch that we will stay away!,-1,10,21-Dec-14,"Having dine in many different Poulet, never had major issue with other branch. When we dine in the Westgate outlet, their food was below expectation, some of the dishes were too salty. Service was horrified, they are under staff with poor management. This is one Poulet our family will stay away. "
French,Poulet,Inexplicably popular below-average restaurant,-1,20,30-Jun-14,"This seemed to be hugely popular with locals so we gave it a try. Sadly I can't understand for the life of me why it's such an attraction.The signature dish, chicken, is OK. To western tastes the standard cream & mushroom sauce will likely be far too sweet (I'm pretty sure it was mostly condensed milk, not cream) and although the chicken is OK it's nothing special and needs the sauce as the breast can be a little dry.The sweetcorn potato side order was tiny and tasteless, the fries were fine (though it's hard to screw those up) and the overall experience felt like bad hawker centre fare.Service wasn't brilliant, our starters were completely forgotten and when ""they"" arrived they had forgotten my order. In the end, looking at 4 limp frankfurters on a plate and thinking they were far from French garlic sausage I just let it go. Condiments have clearly just been scraped onto the side of the plate from the jar and left a lot to be desired on the appearance front. At least we were only charged for the one starter that was delivered.In a nutshell it wasn't dreadful but against the competition I cannot for the life of me understand why this place is still in business and, seemingly, so popular. Even bog standard chicken rice is nicer."
